Event_Name,Code,UMask,Counter,Counter_HT_Off,Description,MSR_Index,MSR_Value,Taken_Alone,Counter_Mask,Invert,AnyThread,Edge_Detect,eLLC_Present,PEBS,Data_LA,L1_Hit_Indication,Errata
INST_RETIRED.ANY,0x00,0x01,"FIXED COUNTER 1","FIXED COUNTER 1","Instructions retired from execution.",0,0,0,0,0,0,0,0,0,0,0,0
CPU_CLK_UNHALTED.THREAD,0x00,0x02,"FIXED COUNTER 2","FIXED COUNTER 2","Core cycles when the core is not in halt state.",0,0,0,0,0,0,0,0,0,0,0,0
CPU_CLK_UNHALTED.REF_TSC,0x00,0x03,"FIXED COUNTER 3","FIXED COUNTER 3","Reference cycles when the core is not in halt state.",0,0,0,0,0,0,0,0,0,0,0,0
LD_BLOCKS.STORE_FORWARD,0x03,0x02,"0,1,2,3","0,1,2,3,4,5,6,7","Cases when loads get true Block-on-Store blocking code preventing store forwarding",0,0,0,0,0,0,0,0,0,0,0,0
LD_BLOCKS.NO_SR,0x03,0x08,"0,1,2,3","0,1,2,3,4,5,6,7","This event counts the number of times that split load operations are temporarily blocked because all resources for handling the split accesses are in use.",0,0,0,0,0,0,0,0,0,0,0,0
MISALIGN_MEM_REF.LOADS,0x05,0x01,"0,1,2,3","0,1,2,3,4,5,6,7","Speculative cache line split load uops dispatched to L1 cache",0,0,0,0,0,0,0,0,0,0,0,0
MISALIGN_MEM_REF.STORES,0x05,0x02,"0,1,2,3","0,1,2,3,4,5,6,7","Speculative cache line split STA uops dispatched to L1 cache",0,0,0,0,0,0,0,0,0,0,0,0
LD_BLOCKS_PARTIAL.ADDRESS_ALIAS,0x07,0x01,"0,1,2,3","0,1,2,3,4,5,6,7","False dependencies in MOB due to partial address comparison",0,0,0,0,0,0,0,0,0,0,0,0
DTLB_LOAD_MISSES.MISS_CAUSES_A_WALK,0x08,0x01,"0,1,2,3","0,1,2,3,4,5,6,7","Load misses in all DTLB levels that cause page walks",0,0,0,0,0,0,0,0,0,0,0,0
DTLB_LOAD_MISSES.WALK_COMPLETED_4K,0x08,0x02,"0,1,2,3","0,1,2,3,4,5,6,7","Demand load Miss in all translation lookaside buffer (TLB) levels causes a page walk that completes (4K).",0,0,0,0,0,0,0,0,0,0,0,0
DTLB_LOAD_MISSES.WALK_COMPLETED_2M_4M,0x08,0x04,"0,1,2,3","0,1,2,3,4,5,6,7","Demand load Miss in all translation lookaside buffer (TLB) levels causes a page walk that completes (2M/4M).",0,0,0,0,0,0,0,0,0,0,0,0
DTLB_LOAD_MISSES.WALK_DURATION,0x08,0x10,"0,1,2,3","0,1,2,3,4,5,6,7","Cycles when PMH is busy with page walks",0,0,0,0,0,0,0,0,0,0,0,0
DTLB_LOAD_MISSES.STLB_HIT_4K,0x08,0x20,"0,1,2,3","0,1,2,3,4,5,6,7","Load misses that miss the  DTLB and hit the STLB (4K)",0,0,0,0,0,0,0,0,0,0,0,0
DTLB_LOAD_MISSES.STLB_HIT_2M,0x08,0x40,"0,1,2,3","0,1,2,3,4,5,6,7","Load misses that miss the  DTLB and hit the STLB (2M)",0,0,0,0,0,0,0,0,0,0,0,0
DTLB_LOAD_MISSES.PDE_CACHE_MISS,0x08,0x80,"0,1,2,3","0,1,2,3,4,5,6,7","DTLB demand load misses with low part of linear-to-physical address translation missed",0,0,0,0,0,0,0,0,0,0,0,0
INT_MISC.RECOVERY_CYCLES,0x0D,0x03,"0,1,2,3","0,1,2,3,4,5,6,7","Number of cycles waiting for the checkpoints in Resource Allocation Table (RAT) to be recovered after Nuke due to all other cases except JEClear (e.g. whenever a ucode assist is needed like SSE exception, memory disambiguation, etc...)",0,0,0,1,0,0,0,0,0,0,0,0
UOPS_ISSUED.ANY,0x0E,0x01,"0,1,2,3","0,1,2,3,4,5,6,7","Uops that Resource Allocation Table (RAT) issues to Reservation Station (RS)",0,0,0,0,0,0,0,0,0,0,0,0
UOPS_ISSUED.FLAGS_MERGE,0x0E,0x10,"0,1,2,3","0,1,2,3,4,5,6,7","Number of flags-merge uops being allocated. Such uops considered perf sensitive; added by GSR u-arch.",0,0,0,0,0,0,0,0,0,0,0,0
UOPS_ISSUED.SLOW_LEA,0x0E,0x20,"0,1,2,3","0,1,2,3,4,5,6,7","Number of slow LEA uops being allocated. A uop is generally considered SlowLea if it has 3 sources (e.g. 2 sources + immediate) regardless if as a result of LEA instruction or not.",0,0,0,0,0,0,0,0,0,0,0,0
UOPS_ISSUED.SINGLE_MUL,0x0E,0x40,"0,1,2,3","0,1,2,3,4,5,6,7","Number of Multiply packed/scalar single precision uops allocated",0,0,0,0,0,0,0,0,0,0,0,0
UOPS_ISSUED.STALL_CYCLES,0x0E,0x01,"0,1,2,3","0,1,2,3","Cycles when Resource Allocation Table (RAT) does not issue Uops to Reservation Station (RS) for the thread",0,0,0,1,1,0,0,0,0,0,0,0
UOPS_ISSUED.CORE_STALL_CYCLES,0x0E,0x01,"0,1,2,3","0,1,2,3","Cycles when Resource Allocation Table (RAT) does not issue Uops to Reservation Station (RS) for all threads",0,0,0,1,1,1,0,0,0,0,0,0
L2_RQSTS.DEMAND_DATA_RD_MISS,0x24,0x21,"0,1,2,3","0,1,2,3,4,5,6,7","Demand Data Read miss L2, no rejects",0,0,0,0,0,0,0,0,0,0,0,0
L2_RQSTS.DEMAND_DATA_RD_HIT,0x24,0x41,"0,1,2,3","0,1,2,3,4,5,6,7","Demand Data Read requests that hit L2 cache",0,0,0,0,0,0,0,0,0,0,0,0
L2_RQSTS.L2_PF_MISS,0x24,0x30,"0,1,2,3","0,1,2,3,4,5,6,7","L2 prefetch requests that miss L2 cache",0,0,0,0,0,0,0,0,0,0,0,0
L2_RQSTS.L2_PF_HIT,0x24,0x50,"0,1,2,3","0,1,2,3,4,5,6,7","L2 prefetch requests that hit L2 cache",0,0,0,0,0,0,0,0,0,0,0,0
L2_RQSTS.ALL_DEMAND_DATA_RD,0x24,0xE1,"0,1,2,3","0,1,2,3,4,5,6,7","Demand Data Read requests",0,0,0,0,0,0,0,0,0,0,0,0
L2_RQSTS.ALL_RFO,0x24,0xE2,"0,1,2,3","0,1,2,3,4,5,6,7","RFO requests to L2 cache",0,0,0,0,0,0,0,0,0,0,0,0
L2_RQSTS.ALL_CODE_RD,0x24,0xE4,"0,1,2,3","0,1,2,3,4,5,6,7","L2 code requests",0,0,0,0,0,0,0,0,0,0,0,0
L2_RQSTS.ALL_PF,0x24,0xF8,"0,1,2,3","0,1,2,3,4,5,6,7","Requests from L2 hardware prefetchers",0,0,0,0,0,0,0,0,0,0,0,0
L2_DEMAND_RQSTS.WB_HIT,0x27,0x50,"0,1,2,3","0,1,2,3,4,5,6,7","Not rejected writebacks that hit L2 cache",0,0,0,0,0,0,0,0,0,0,0,0
LONGEST_LAT_CACHE.MISS,0x2e,0x41,"0,1,2,3","0,1,2,3,4,5,6,7","Core-originated cacheable demand requests missed L3",0,0,0,0,0,0,0,0,0,0,0,0
LONGEST_LAT_CACHE.REFERENCE,0x2e,0x4F,"0,1,2,3","0,1,2,3,4,5,6,7","Core-originated cacheable demand requests that refer to L3",0,0,0,0,0,0,0,0,0,0,0,0
CPU_CLK_THREAD_UNHALTED.REF_XCLK,0x3c,0x01,"0,1,2,3","0,1,2,3,4,5,6,7","Cases when the core is unhalted at 100 Mhz",0,0,0,0,0,0,0,0,0,0,0,0
L1D_PEND_MISS.PENDING,0x48,0x01,2,2,"L1D miss oustandings duration in cycles",0,0,0,0,0,0,0,0,0,0,0,0
L1D_PEND_MISS.PENDING_CYCLES,0x48,0x01,2,2,"Cycles with L1D load Misses outstanding.",0,0,0,1,0,0,0,0,0,0,0,0
L1D_PEND_MISS.OCCURENCES,0x48,0x01,2,2,"This event counts the number of L1D misses outstanding, using an edge detect to count transitions.",0,0,0,1,0,0,1,0,0,0,0,0
DTLB_STORE_MISSES.MISS_CAUSES_A_WALK,0x49,0x01,"0,1,2,3","0,1,2,3,4,5,6,7","Store misses in all DTLB levels that cause page walks",0,0,0,0,0,0,0,0,0,0,0,0
DTLB_STORE_MISSES.WALK_COMPLETED_4K,0x49,0x02,"0,1,2,3","0,1,2,3,4,5,6,7","Store miss in all TLB levels causes a page walk that completes. (4K)",0,0,0,0,0,0,0,0,0,0,0,0
DTLB_STORE_MISSES.WALK_COMPLETED_2M_4M,0x49,0x04,"0,1,2,3","0,1,2,3,4,5,6,7","Store misses in all DTLB levels that cause completed page walks (2M/4M)",0,0,0,0,0,0,0,0,0,0,0,0
DTLB_STORE_MISSES.WALK_DURATION,0x49,0x10,"0,1,2,3","0,1,2,3,4,5,6,7","Cycles when PMH is busy with page walks",0,0,0,0,0,0,0,0,0,0,0,0
DTLB_STORE_MISSES.STLB_HIT_4K,0x49,0x20,"0,1,2,3","0,1,2,3,4,5,6,7","Store misses that miss the  DTLB and hit the STLB (4K)",0,0,0,0,0,0,0,0,0,0,0,0
DTLB_STORE_MISSES.STLB_HIT_2M,0x49,0x40,"0,1,2,3","0,1,2,3,4,5,6,7","Store misses that miss the  DTLB and hit the STLB (2M)",0,0,0,0,0,0,0,0,0,0,0,0
DTLB_STORE_MISSES.PDE_CACHE_MISS,0x49,0x80,"0,1,2,3","0,1,2,3,4,5,6,7","DTLB store misses with low part of linear-to-physical address translation missed",0,0,0,0,0,0,0,0,0,0,0,0
LOAD_HIT_PRE.SW_PF,0x4c,0x01,"0,1,2,3","0,1,2,3,4,5,6,7","Not software-prefetch load dispatches that hit FB allocated for software prefetch",0,0,0,0,0,0,0,0,0,0,0,0
LOAD_HIT_PRE.HW_PF,0x4c,0x02,"0,1,2,3","0,1,2,3,4,5,6,7","Not software-prefetch load dispatches that hit FB allocated for hardware prefetch",0,0,0,0,0,0,0,0,0,0,0,0
L1D.REPLACEMENT,0x51,0x01,"0,1,2,3","0,1,2,3,4,5,6,7","L1D data line replacements",0,0,0,0,0,0,0,0,0,0,0,0
TX_MEM.ABORT_CONFLICT,0x54,0x01,"0,1,2,3","0,1,2,3,4,5,6,7","Number of times a TSX line had a cache conflict",0,0,0,0,0,0,0,0,0,0,0,0
TX_MEM.ABORT_CAPACITY,0x54,0x02,"0,1,2,3","0,1,2,3,4,5,6,7","Number of times a TSX Abort was triggered due to an evicted line caused by a transaction overflow",0,0,0,0,0,0,0,0,0,0,0,0
TX_MEM.ABORT_HLE_STORE_TO_ELIDED_LOCK,0x54,0x04,"0,1,2,3","0,1,2,3,4,5,6,7","Number of times a TSX Abort was triggered due to a non-release/commit store to lock",0,0,0,0,0,0,0,0,0,0,0,0
TX_MEM.ABORT_HLE_ELISION_BUFFER_NOT_EMPTY,0x54,0x08,"0,1,2,3","0,1,2,3,4,5,6,7","Number of times a TSX Abort was triggered due to commit but Lock Buffer not empty",0,0,0,0,0,0,0,0,0,0,0,0
TX_MEM.ABORT_HLE_ELISION_BUFFER_MISMATCH,0x54,0x10,"0,1,2,3","0,1,2,3,4,5,6,7","Number of times a TSX Abort was triggered due to release/commit but data and address mismatch",0,0,0,0,0,0,0,0,0,0,0,0
TX_MEM.ABORT_HLE_ELISION_BUFFER_UNSUPPORTED_ALIGNMENT,0x54,0x20,"0,1,2,3","0,1,2,3,4,5,6,7","Number of times a TSX Abort was triggered due to attempting an unsupported alignment from Lock Buffer",0,0,0,0,0,0,0,0,0,0,0,0
TX_MEM.ABORT_HLE_ELISION_BUFFER_FULL,0x54,0x40,"0,1,2,3","0,1,2,3,4,5,6,7","Number of times we could not allocate Lock Buffer",0,0,0,0,0,0,0,0,0,0,0,0
MOVE_ELIMINATION.INT_ELIMINATED,0x58,0x01,"0,1,2,3","0,1,2,3,4,5,6,7","Number of integer Move Elimination candidate uops that were eliminated.",0,0,0,0,0,0,0,0,0,0,0,0
MOVE_ELIMINATION.SIMD_ELIMINATED,0x58,0x02,"0,1,2,3","0,1,2,3,4,5,6,7","Number of SIMD Move Elimination candidate uops that were eliminated.",0,0,0,0,0,0,0,0,0,0,0,0
MOVE_ELIMINATION.INT_NOT_ELIMINATED,0x58,0x04,"0,1,2,3","0,1,2,3,4,5,6,7","Number of integer Move Elimination candidate uops that were not eliminated.",0,0,0,0,0,0,0,0,0,0,0,0
MOVE_ELIMINATION.SIMD_NOT_ELIMINATED,0x58,0x08,"0,1,2,3","0,1,2,3,4,5,6,7","Number of SIMD Move Elimination candidate uops that were not eliminated.",0,0,0,0,0,0,0,0,0,0,0,0
CPL_CYCLES.RING0,0x5C,0x01,"0,1,2,3","0,1,2,3,4,5,6,7","Unhalted core cycles when the thread is in ring 0",0,0,0,0,0,0,0,0,0,0,0,0
CPL_CYCLES.RING123,0x5C,0x02,"0,1,2,3","0,1,2,3,4,5,6,7","Unhalted core cycles when thread is in rings 1, 2, or 3",0,0,0,0,0,0,0,0,0,0,0,0
CPL_CYCLES.RING0_TRANS,0x5C,0x01,"0,1,2,3","0,1,2,3,4,5,6,7","Number of intervals between processor halts while thread is in ring 0",0,0,0,1,0,0,1,0,0,0,0,0
TX_EXEC.MISC1,0x5d,0x01,"0,1,2,3","0,1,2,3,4,5,6,7","Unfriendly TSX abort triggered by  a flowmarker",0,0,0,0,0,0,0,0,0,0,0,0
TX_EXEC.MISC2,0x5d,0x02,"0,1,2,3","0,1,2,3,4,5,6,7","Unfriendly TSX abort triggered by  a vzeroupper instruction",0,0,0,0,0,0,0,0,0,0,0,0
TX_EXEC.MISC3,0x5d,0x04,"0,1,2,3","0,1,2,3,4,5,6,7","Unfriendly TSX abort triggered by a nest count that is too deep",0,0,0,0,0,0,0,0,0,0,0,0
TX_EXEC.MISC4,0x5d,0x08,"0,1,2,3","0,1,2,3,4,5,6,7","RTM region detected inside HLE",0,0,0,0,0,0,0,0,0,0,0,0
TX_EXEC.MISC5,0x5d,0x10,"0,1,2,3","0,1,2,3,4,5,6,7",tbd,0,0,0,0,0,0,0,0,0,0,0,0
RS_EVENTS.EMPTY_CYCLES,0x5E,0x01,"0,1,2,3","0,1,2,3,4,5,6,7","Cycles when Reservation Station (RS) is empty for the thread",0,0,0,0,0,0,0,0,0,0,0,0
OFFCORE_REQUESTS_OUTSTANDING.DEMAND_DATA_RD,0x60,0x01,"0,1,2,3","0,1,2,3,4,5,6,7","Offcore outstanding Demand Data Read transactions in uncore queue.",0,0,0,0,0,0,0,0,0,0,0,"Disable SMT"
OFFCORE_REQUESTS_OUTSTANDING.DEMAND_CODE_RD,0x60,0x02,"0,1,2,3","0,1,2,3,4,5,6,7","Offcore outstanding code reads transactions in SuperQueue (SQ), queue to uncore, every cycle",0,0,0,0,0,0,0,0,0,0,0,"Disable SMT"
OFFCORE_REQUESTS_OUTSTANDING.DEMAND_RFO,0x60,0x04,"0,1,2,3","0,1,2,3,4,5,6,7","Offcore outstanding RFO store transactions in SuperQueue (SQ), queue to uncore",0,0,0,0,0,0,0,0,0,0,0,"Disable SMT"
OFFCORE_REQUESTS_OUTSTANDING.ALL_DATA_RD,0x60,0x08,"0,1,2,3","0,1,2,3,4,5,6,7","Offcore outstanding cacheable Core Data Read transactions in SuperQueue (SQ), queue to uncore",0,0,0,0,0,0,0,0,0,0,0,"Disable SMT"
OFFCORE_REQUESTS_OUTSTANDING.CYCLES_WITH_DEMAND_DATA_RD,0x60,0x01,"0,1,2,3","0,1,2,3,4,5,6,7","Cycles when offcore outstanding Demand Data Read transactions are present in SuperQueue (SQ), queue to uncore",0,0,0,1,0,0,0,0,0,0,0,"Disable SMT"
OFFCORE_REQUESTS_OUTSTANDING.CYCLES_WITH_DATA_RD,0x60,0x08,"0,1,2,3","0,1,2,3,4,5,6,7","Cycles when offcore outstanding cacheable Core Data Read transactions are present in SuperQueue (SQ), queue to uncore",0,0,0,1,0,0,0,0,0,0,0,"Disable SMT"
LOCK_CYCLES.SPLIT_LOCK_UC_LOCK_DURATION,0x63,0x01,"0,1,2,3","0,1,2,3,4,5,6,7","Cycles when L1 and L2 are locked due to UC or split lock",0,0,0,0,0,0,0,0,0,0,0,0
LOCK_CYCLES.CACHE_LOCK_DURATION,0x63,0x02,"0,1,2,3","0,1,2,3,4,5,6,7","Cycles when L1D is locked",0,0,0,0,0,0,0,0,0,0,0,0
IDQ.EMPTY,0x79,0x02,"0,1,2,3","0,1,2,3","Instruction Decode Queue (IDQ) empty cycles",0,0,0,0,0,0,0,0,0,0,0,0
IDQ.MITE_UOPS,0x79,0x04,"0,1,2,3","0,1,2,3,4,5,6,7","Uops delivered to Instruction Decode Queue (IDQ) from MITE path",0,0,0,0,0,0,0,0,0,0,0,0
IDQ.DSB_UOPS,0x79,0x08,"0,1,2,3","0,1,2,3,4,5,6,7","Uops delivered to Instruction Decode Queue (IDQ) from the Decode Stream Buffer (DSB) path",0,0,0,0,0,0,0,0,0,0,0,0
IDQ.MS_DSB_UOPS,0x79,0x10,"0,1,2,3","0,1,2,3,4,5,6,7","Uops initiated by Decode Stream Buffer (DSB) that are being delivered to Instruction Decode Queue (IDQ) while Microcode Sequenser (MS) is busy",0,0,0,0,0,0,0,0,0,0,0,0
IDQ.MS_MITE_UOPS,0x79,0x20,"0,1,2,3","0,1,2,3,4,5,6,7","Uops initiated by MITE and delivered to Instruction Decode Queue (IDQ) while Microcode Sequenser (MS) is busy",0,0,0,0,0,0,0,0,0,0,0,0
IDQ.MS_UOPS,0x79,0x30,"0,1,2,3","0,1,2,3,4,5,6,7","Uops delivered to Instruction Decode Queue (IDQ) while Microcode Sequenser (MS) is busy",0,0,0,0,0,0,0,0,0,0,0,0
IDQ.MS_CYCLES,0x79,0x30,"0,1,2,3","0,1,2,3,4,5,6,7","Cycles when uops are being delivered to Instruction Decode Queue (IDQ) while Microcode Sequenser (MS) is busy",0,0,0,1,0,0,0,0,0,0,0,0
IDQ.MITE_CYCLES,0x79,0x04,"0,1,2,3","0,1,2,3,4,5,6,7","Cycles when uops are being delivered to Instruction Decode Queue (IDQ) from MITE path",0,0,0,1,0,0,0,0,0,0,0,0
IDQ.DSB_CYCLES,0x79,0x08,"0,1,2,3","0,1,2,3,4,5,6,7","Cycles when uops are being delivered to Instruction Decode Queue (IDQ) from Decode Stream Buffer (DSB) path",0,0,0,1,0,0,0,0,0,0,0,0
IDQ.MS_DSB_CYCLES,0x79,0x10,"0,1,2,3","0,1,2,3,4,5,6,7","Cycles when uops initiated by Decode Stream Buffer (DSB) are being delivered to Instruction Decode Queue (IDQ) while Microcode Sequenser (MS) is busy",0,0,0,1,0,0,0,0,0,0,0,0
IDQ.MS_DSB_OCCUR,0x79,0x10,"0,1,2,3","0,1,2,3,4,5,6,7","Deliveries to Instruction Decode Queue (IDQ) initiated by Decode Stream Buffer (DSB) while Microcode Sequenser (MS) is busy",0,0,0,1,0,0,1,0,0,0,0,0
IDQ.ALL_DSB_CYCLES_4_UOPS,0x79,0x18,"0,1,2,3","0,1,2,3,4,5,6,7","Cycles Decode Stream Buffer (DSB) is delivering 4 Uops",0,0,0,4,0,0,0,0,0,0,0,0
IDQ.ALL_DSB_CYCLES_ANY_UOPS,0x79,0x18,"0,1,2,3","0,1,2,3,4,5,6,7","Cycles Decode Stream Buffer (DSB) is delivering any Uop",0,0,0,1,0,0,0,0,0,0,0,0
IDQ.ALL_MITE_CYCLES_4_UOPS,0x79,0x24,"0,1,2,3","0,1,2,3,4,5,6,7","Cycles MITE is delivering 4 Uops",0,0,0,4,0,0,0,0,0,0,0,0
IDQ.ALL_MITE_CYCLES_ANY_UOPS,0x79,0x24,"0,1,2,3","0,1,2,3,4,5,6,7","Cycles MITE is delivering any Uop",0,0,0,1,0,0,0,0,0,0,0,0
IDQ.MITE_ALL_UOPS,0x79,0x3c,"0,1,2,3","0,1,2,3,4,5,6,7","Uops delivered to Instruction Decode Queue (IDQ) from MITE path",0,0,0,0,0,0,0,0,0,0,0,0
ICACHE.MISSES,0x80,0x02,"0,1,2,3","0,1,2,3,4,5,6,7","Number of Instruction Cache, Streaming Buffer and Victim Cache Misses. Includes Uncacheable accesses.",0,0,0,0,0,0,0,0,0,0,0,0
ITLB_MISSES.MISS_CAUSES_A_WALK,0x85,0x01,"0,1,2,3","0,1,2,3,4,5,6,7","Misses at all ITLB levels that cause page walks",0,0,0,0,0,0,0,0,0,0,0,0
ITLB_MISSES.WALK_COMPLETED_4K,0x85,0x02,"0,1,2,3","0,1,2,3,4,5,6,7","Code miss in all TLB levels causes a page walk that completes. (4K)",0,0,0,0,0,0,0,0,0,0,0,0
ITLB_MISSES.WALK_COMPLETED_2M_4M,0x85,0x04,"0,1,2,3","0,1,2,3,4,5,6,7","Code miss in all TLB levels causes a page walk that completes. (2M/4M)",0,0,0,0,0,0,0,0,0,0,0,0
ITLB_MISSES.WALK_DURATION,0x85,0x10,"0,1,2,3","0,1,2,3,4,5,6,7","Cycles when PMH is busy with page walks",0,0,0,0,0,0,0,0,0,0,0,0
ITLB_MISSES.STLB_HIT_4K,0x85,0x20,"0,1,2,3","0,1,2,3,4,5,6,7","Core misses that miss the  DTLB and hit the STLB (4K)",0,0,0,0,0,0,0,0,0,0,0,0
ITLB_MISSES.STLB_HIT_2M,0x85,0x40,"0,1,2,3","0,1,2,3,4,5,6,7","Code misses that miss the  DTLB and hit the STLB (2M)",0,0,0,0,0,0,0,0,0,0,0,0
ILD_STALL.LCP,0x87,0x01,"0,1,2,3","0,1,2,3,4,5,6,7","Stalls caused by changing prefix length of the instruction.",0,0,0,0,0,0,0,0,0,0,0,0
ILD_STALL.IQ_FULL,0x87,0x04,"0,1,2,3","0,1,2,3,4,5,6,7","Stall cycles because IQ is full",0,0,0,0,0,0,0,0,0,0,0,0
BR_INST_EXEC.NONTAKEN_CONDITIONAL,0x88,0x41,"0,1,2,3","0,1,2,3,4,5,6,7","Not taken macro-conditional branches",0,0,0,0,0,0,0,0,0,0,0,0
BR_INST_EXEC.TAKEN_CONDITIONAL,0x88,0x81,"0,1,2,3","0,1,2,3,4,5,6,7","Taken speculative and retired macro-conditional branches",0,0,0,0,0,0,0,0,0,0,0,0
BR_INST_EXEC.TAKEN_DIRECT_JUMP,0x88,0x82,"0,1,2,3","0,1,2,3,4,5,6,7","Taken speculative and retired macro-conditional branch instructions excluding calls and indirects",0,0,0,0,0,0,0,0,0,0,0,0
BR_INST_EXEC.TAKEN_INDIRECT_JUMP_NON_CALL_RET,0x88,0x84,"0,1,2,3","0,1,2,3,4,5,6,7","Taken speculative and retired indirect branches excluding calls and returns",0,0,0,0,0,0,0,0,0,0,0,0
BR_INST_EXEC.TAKEN_INDIRECT_NEAR_RETURN,0x88,0x88,"0,1,2,3","0,1,2,3,4,5,6,7","Taken speculative and retired indirect branches with return mnemonic",0,0,0,0,0,0,0,0,0,0,0,0
BR_INST_EXEC.TAKEN_DIRECT_NEAR_CALL,0x88,0x90,"0,1,2,3","0,1,2,3,4,5,6,7","Taken speculative and retired direct near calls",0,0,0,0,0,0,0,0,0,0,0,0
BR_INST_EXEC.TAKEN_INDIRECT_NEAR_CALL,0x88,0xA0,"0,1,2,3","0,1,2,3,4,5,6,7","Taken speculative and retired indirect calls",0,0,0,0,0,0,0,0,0,0,0,0
BR_INST_EXEC.ALL_CONDITIONAL,0x88,0xC1,"0,1,2,3","0,1,2,3,4,5,6,7","Speculative and retired macro-conditional branches",0,0,0,0,0,0,0,0,0,0,0,0
BR_INST_EXEC.ALL_DIRECT_JMP,0x88,0xC2,"0,1,2,3","0,1,2,3,4,5,6,7","Speculative and retired macro-unconditional branches excluding calls and indirects",0,0,0,0,0,0,0,0,0,0,0,0
BR_INST_EXEC.ALL_INDIRECT_JUMP_NON_CALL_RET,0x88,0xC4,"0,1,2,3","0,1,2,3,4,5,6,7","Speculative and retired indirect branches excluding calls and returns",0,0,0,0,0,0,0,0,0,0,0,0
BR_INST_EXEC.ALL_INDIRECT_NEAR_RETURN,0x88,0xC8,"0,1,2,3","0,1,2,3,4,5,6,7","Speculative and retired indirect return branches.",0,0,0,0,0,0,0,0,0,0,0,0
BR_INST_EXEC.ALL_DIRECT_NEAR_CALL,0x88,0xD0,"0,1,2,3","0,1,2,3,4,5,6,7","Speculative and retired direct near calls",0,0,0,0,0,0,0,0,0,0,0,0
BR_INST_EXEC.ALL_BRANCHES,0x88,0xFF,"0,1,2,3","0,1,2,3,4,5,6,7","Speculative and retired  branches",0,0,0,0,0,0,0,0,0,0,0,0
BR_MISP_EXEC.NONTAKEN_CONDITIONAL,0x89,0x41,"0,1,2,3","0,1,2,3,4,5,6,7","Not taken speculative and retired mispredicted macro conditional branches",0,0,0,0,0,0,0,0,0,0,0,0
BR_MISP_EXEC.TAKEN_CONDITIONAL,0x89,0x81,"0,1,2,3","0,1,2,3,4,5,6,7","Taken speculative and retired mispredicted macro conditional branches",0,0,0,0,0,0,0,0,0,0,0,0
BR_MISP_EXEC.TAKEN_INDIRECT_JUMP_NON_CALL_RET,0x89,0x84,"0,1,2,3","0,1,2,3,4,5,6,7","Taken speculative and retired mispredicted indirect branches excluding calls and returns",0,0,0,0,0,0,0,0,0,0,0,0
BR_MISP_EXEC.TAKEN_RETURN_NEAR,0x89,0x88,"0,1,2,3","0,1,2,3,4,5,6,7","Taken speculative and retired mispredicted indirect branches with return mnemonic",0,0,0,0,0,0,0,0,0,0,0,0
BR_MISP_EXEC.ALL_CONDITIONAL,0x89,0xC1,"0,1,2,3","0,1,2,3,4,5,6,7","Speculative and retired mispredicted macro conditional branches",0,0,0,0,0,0,0,0,0,0,0,0
BR_MISP_EXEC.ALL_INDIRECT_JUMP_NON_CALL_RET,0x89,0xC4,"0,1,2,3","0,1,2,3,4,5,6,7","Mispredicted indirect branches excluding calls and returns",0,0,0,0,0,0,0,0,0,0,0,0
BR_MISP_EXEC.ALL_BRANCHES,0x89,0xFF,"0,1,2,3","0,1,2,3,4,5,6,7","Speculative and retired mispredicted macro conditional branches",0,0,0,0,0,0,0,0,0,0,0,0
IDQ_UOPS_NOT_DELIVERED.CORE,0x9c,0x01,"0,1,2,3","0,1,2,3","Uops not delivered to Resource Allocation Table (RAT) per thread when backend of the machine is not stalled",0,0,0,0,0,0,0,0,0,0,0,0
IDQ_UOPS_NOT_DELIVERED.CYCLES_0_UOPS_DELIV.CORE,0x9C,0x01,"0,1,2,3","0,1,2,3","Cycles per thread when 4 or more uops are not delivered to Resource Allocation Table (RAT) when backend of the machine is not stalled",0,0,0,4,0,0,0,0,0,0,0,0
IDQ_UOPS_NOT_DELIVERED.CYCLES_LE_1_UOP_DELIV.CORE,0x9C,0x01,"0,1,2,3","0,1,2,3","Cycles per thread when 3 or more uops are not delivered to Resource Allocation Table (RAT) when backend of the machine is not stalled",0,0,0,3,0,0,0,0,0,0,0,0
IDQ_UOPS_NOT_DELIVERED.CYCLES_LE_2_UOP_DELIV.CORE,0x9C,0x01,"0,1,2,3","0,1,2,3","Cycles with less than 2 uops delivered by the front end.",0,0,0,2,0,0,0,0,0,0,0,0
IDQ_UOPS_NOT_DELIVERED.CYCLES_LE_3_UOP_DELIV.CORE,0x9C,0x01,"0,1,2,3","0,1,2,3","Cycles with less than 3 uops delivered by the front end.",0,0,0,1,0,0,0,0,0,0,0,0
IDQ_UOPS_NOT_DELIVERED.CYCLES_FE_WAS_OK,0x9C,0x01,"0,1,2,3","0,1,2,3","Counts cycles FE delivered 4 uops or Resource Allocation Table (RAT) was stalling FE.",0,0,0,1,1,0,0,0,0,0,0,0
UOPS_EXECUTED_PORT.PORT_0,0xA1,0x01,"0,1,2,3","0,1,2,3,4,5,6,7","Cycles per thread when uops are executed in port 0",0,0,0,0,0,0,0,0,0,0,0,0
UOPS_EXECUTED_PORT.PORT_1,0xA1,0x02,"0,1,2,3","0,1,2,3,4,5,6,7","Cycles per thread when uops are executed in port 1",0,0,0,0,0,0,0,0,0,0,0,0
UOPS_EXECUTED_PORT.PORT_2,0xA1,0x04,"0,1,2,3","0,1,2,3,4,5,6,7","Cycles per thread when uops are executed in port 2",0,0,0,0,0,0,0,0,0,0,0,0
UOPS_EXECUTED_PORT.PORT_3,0xA1,0x08,"0,1,2,3","0,1,2,3,4,5,6,7","Cycles per thread when uops are executed in port 3",0,0,0,0,0,0,0,0,0,0,0,0
UOPS_EXECUTED_PORT.PORT_4,0xA1,0x10,"0,1,2,3","0,1,2,3,4,5,6,7","Cycles per thread when uops are executed in port 4",0,0,0,0,0,0,0,0,0,0,0,0
UOPS_EXECUTED_PORT.PORT_5,0xA1,0x20,"0,1,2,3","0,1,2,3,4,5,6,7","Cycles per thread when uops are executed in port 5",0,0,0,0,0,0,0,0,0,0,0,0
UOPS_EXECUTED_PORT.PORT_6,0xA1,0x40,"0,1,2,3","0,1,2,3,4,5,6,7","Cycles per thread when uops are executed in port 6",0,0,0,0,0,0,0,0,0,0,0,0
UOPS_EXECUTED_PORT.PORT_7,0xA1,0x80,"0,1,2,3","0,1,2,3,4,5,6,7","Cycles per thread when uops are executed in port 7",0,0,0,0,0,0,0,0,0,0,0,0
RESOURCE_STALLS.ANY,0xA2,0x01,"0,1,2,3","0,1,2,3,4,5,6,7","Resource-related stall cycles",0,0,0,0,0,0,0,0,0,0,0,0
RESOURCE_STALLS.RS,0xA2,0x04,"0,1,2,3","0,1,2,3,4,5,6,7","Cycles stalled due to no eligible RS entry available.",0,0,0,0,0,0,0,0,0,0,0,0
RESOURCE_STALLS.SB,0xA2,0x08,"0,1,2,3","0,1,2,3,4,5,6,7","Cycles stalled due to no store buffers available. (not including draining form sync).",0,0,0,0,0,0,0,0,0,0,0,0
RESOURCE_STALLS.ROB,0xA2,0x10,"0,1,2,3","0,1,2,3,4,5,6,7","Cycles stalled due to re-order buffer full.",0,0,0,0,0,0,0,0,0,0,0,0
CYCLE_ACTIVITY.CYCLES_L1D_PENDING,0xA3,0x08,2,2,"Cycles with pending L1 cache miss loads.",0,0,0,8,0,0,0,0,0,0,0,0
CYCLE_ACTIVITY.CYCLES_LDM_PENDING,0xA3,0x02,"0,1,2,3","0,1,2,3,4,5,6,7","Cycles with pending memory loads.",0,0,0,2,0,0,0,0,0,0,0,0
CYCLE_ACTIVITY.CYCLES_NO_EXECUTE,0xA3,0x04,"0,1,2,3","0,1,2,3","Total execution stalls",0,0,0,4,0,0,0,0,0,0,0,0
CYCLE_ACTIVITY.STALLS_LDM_PENDING,0xA3,0x06,"0,1,2,3","0,1,2,3,4,5,6,7","Execution stalls due to memory subsystem.",0,0,0,6,0,0,0,0,0,0,0,0
LSD.UOPS,0xa8,0x01,"0,1,2,3","0,1,2,3,4,5,6,7","Number of Uops delivered by the LSD. Read more on LSD under LSD_REPLAY.REPLAY",0,0,0,0,0,0,0,0,0,0,0,0
ITLB.ITLB_FLUSH,0xae,0x01,"0,1,2,3","0,1,2,3,4,5,6,7","Flushing of the Instruction TLB (ITLB) pages, includes 4k/2M/4M pages.",0,0,0,0,0,0,0,0,0,0,0,0
OFFCORE_REQUESTS.DEMAND_DATA_RD,0xb0,0x01,"0,1,2,3","0,1,2,3,4,5,6,7","Demand Data Read requests sent to uncore",0,0,0,0,0,0,0,0,0,0,0,"Disable SMT"
OFFCORE_REQUESTS.DEMAND_CODE_RD,0xb0,0x02,"0,1,2,3","0,1,2,3,4,5,6,7","Cacheable and noncachaeble code read requests",0,0,0,0,0,0,0,0,0,0,0,"Disable SMT"
OFFCORE_REQUESTS.DEMAND_RFO,0xb0,0x04,"0,1,2,3","0,1,2,3,4,5,6,7","Demand RFO requests including regular RFOs, locks, ItoM",0,0,0,0,0,0,0,0,0,0,0,"Disable SMT"
OFFCORE_REQUESTS.ALL_DATA_RD,0xb0,0x08,"0,1,2,3","0,1,2,3,4,5,6,7","Demand and prefetch data reads",0,0,0,0,0,0,0,0,0,0,0,"Disable SMT"
UOPS_EXECUTED.THREAD,0xb1,0x01,"0,1,2,3","0,1,2,3,4,5,6,7","Counts the number of uops to be executed per-thread each cycle.",0,0,0,0,0,0,0,0,0,0,0,0
UOPS_EXECUTED.CORE,0xb1,0x02,"0,1,2,3","0,1,2,3,4,5,6,7","Number of uops executed on the core.",0,0,0,0,0,0,0,0,0,0,0,0
UOPS_EXECUTED.STALL_CYCLES,0xB1,0x01,"0,1,2,3","0,1,2,3","Counts number of cycles no uops were dispatched to be executed on this thread.",0,0,0,1,1,0,0,0,0,0,0,0
PAGE_WALKER_LOADS.DTLB_L1,0xBC,0x11,"0,1,2,3","0,1,2,3","Number of DTLB page walker hits in the L1+FB",0,0,0,0,0,0,0,0,0,0,0,0
PAGE_WALKER_LOADS.ITLB_L1,0xBC,0x21,"0,1,2,3","0,1,2,3","Number of ITLB page walker hits in the L1+FB",0,0,0,0,0,0,0,0,0,0,0,0
PAGE_WALKER_LOADS.DTLB_L2,0xBC,0x12,"0,1,2,3","0,1,2,3","Number of DTLB page walker hits in the L2",0,0,0,0,0,0,0,0,0,0,0,0
PAGE_WALKER_LOADS.ITLB_L2,0xBC,0x22,"0,1,2,3","0,1,2,3","Number of ITLB page walker hits in the L2",0,0,0,0,0,0,0,0,0,0,0,0
PAGE_WALKER_LOADS.DTLB_L3,0xBC,0x14,"0,1,2,3","0,1,2,3","Number of DTLB page walker hits in the L3 + XSNP",0,0,0,0,0,0,0,0,0,0,0,0
PAGE_WALKER_LOADS.ITLB_L3,0xBC,0x24,"0,1,2,3","0,1,2,3","Number of ITLB page walker hits in the L3 + XSNP",0,0,0,0,0,0,0,0,0,0,0,0
PAGE_WALKER_LOADS.DTLB_MEMORY,0xBC,0x18,"0,1,2,3","0,1,2,3","Number of DTLB page walker hits in Memory",0,0,0,0,0,0,0,0,0,0,0,0
PAGE_WALKER_LOADS.IA32_ITLB_MEMORY,0xBC,0x28,"0,1,2,3","0,1,2,3","Number of ITLB page walker hits in Memory",0,0,0,0,0,0,0,0,0,0,0,0
TLB_FLUSH.DTLB_THREAD,0xBD,0x01,"0,1,2,3","0,1,2,3,4,5,6,7","DTLB flush attempts of the thread-specific entries",0,0,0,0,0,0,0,0,0,0,0,0
TLB_FLUSH.STLB_ANY,0xBD,0x20,"0,1,2,3","0,1,2,3,4,5,6,7","STLB flush attempts",0,0,0,0,0,0,0,0,0,0,0,0
INST_RETIRED.ANY_P,0xC0,0x00,"0,1,2,3","0,1,2,3,4,5,6,7","Number of instructions retired. General Counter   - architectural event",0,0,0,0,0,0,0,0,0,0,0,0
INST_RETIRED.PREC_DIST,0xC0,0x01,1,1,"Precise instruction retired event with HW to reduce effect of PEBS shadow in IP distribution",0,0,0,0,0,0,0,0,0,0,0,0
OTHER_ASSISTS.AVX_TO_SSE,0xC1,0x08,"0,1,2,3","0,1,2,3,4,5,6,7","Number of transitions from AVX-256 to legacy SSE when penalty applicable.",0,0,0,0,0,0,0,0,0,0,0,0
